{
  "$schema": "./schemas/generated-skill.schema.json",
  "schemaVersion": "1.1.0",
  "skill": {
    "id": "ai-team-build",
    "name": "AI Team Build Skill",
    "version": "0.6.0",
    "entry": "SKILL.md",
    "description": "Builds complete agent-readable AI team skills from a team specification."
  },
  "runtime": {
    "node": ">=18",
    "packageManager": "npm",
    "requiredCommands": [
      "node",
      "npm"
    ],
    "optionalCommands": [
      "git",
      "npx"
    ],
    "environmentVariables": []
  },
  "entrypoints": {
    "skill": "SKILL.md",
    "readme": "README.md",
    "commands": "commands/team-build.md",
    "validation": "scripts/validate-structure.js",
    "skillAudit": "scripts/audit-skills.js",
    "generatedUpgrade": "scripts/generate-team-skill.js"
  },
  "install": {
    "packageName": "ai-team-build",
    "supportedTargets": [
      "trae",
      "codex",
      "claude",
      "generic-agent"
    ],
    "postInstall": [
      "npm run verify:install"
    ],
    "requiredFiles": [
      "SKILL.md",
      "AGENTS.md",
      "README.md",
      "README_EN.md",
      "package.json",
      "skill-runtime.json",
      "commands/",
      "docs/",
      "schemas/",
      "assets/templates/",
      "scripts/",
      "domain-packs/",
      "examples/",
      "fixtures/"
    ],
    "methods": [
      {
        "id": "git-clone",
        "label": "Git clone",
        "command": "git clone https://github.com/AISuperXiang/ai-team-build.git ai-team-build",
        "verify": "cd ai-team-build && npm run verify:install"
      },
      {
        "id": "current-directory",
        "label": "Use this repository directory",
        "command": "npm run verify:install",
        "verify": "npm run verify:install"
      },
      {
        "id": "manual-copy",
        "label": "Manual directory copy",
        "instructions": [
          "Copy this repository directory into your agent skills root using your platform's file manager or deployment tool.",
          "Run npm run verify:install from the copied directory before registering the skill."
        ],
        "verify": "npm run verify:install"
      }
    ]
  },
  "agentHints": {
    "readOrder": [
      "SKILL.md",
      "commands/team-build.md",
      "schemas/team-spec.schema.json",
      "docs/reference-standard.md",
      "docs/generation-methodology.md",
      "docs/team-scoring-rubric.md",
      "docs/generated-skill-evolution.md",
      "docs/skill-evolution-methodology.md",
      "domain-packs/README.md"
    ],
    "sourceRepository": "https://github.com/AISuperXiang/ai-team-build.git",
    "environmentPolicy": "Run Node scripts from the skill root. Core generation must not require network access or credentials.",
    "generationPolicy": "Create or review a v2 team-spec.json before generating files. New teams include a spec snapshot and managed-file manifest. Use --upgrade for existing generated teams; it preserves untracked files and blocks on managed-file drift. Default output is <skills-root>/<skill.id> unless the spec or command sets another output directory.",
    "executionPolicy": "Generated teams must select complexity, executionProfile, rolePlan, and target verification level before execution. Every generated team receives decision, risk, handoff, evidence, delivery, and workflow-status governance assets.",
    "roleActivationPolicy": "Treat workflow members as a candidate pool. Only active and consulted roles participate; not_applicable roles require scenario evidence and must be reassessed when scope or risk changes.",
    "verificationPolicy": "Factory validation is V2 contract verification. A generated team's real domain capability starts at V0 and may only advance with task-specific evidence; an A-grade blueprint is not business-outcome certification.",
    "evolutionPolicy": "Generated teams preserve a spec snapshot and managed-file manifest. Aggregate structured task feedback before changing the spec, then use --upgrade so local drift becomes an explicit conflict.",
    "skillEvolutionPolicy": "For generated teams, aggregate structured task feedback before changing the spec and use --upgrade so local drift becomes an explicit conflict. For existing Skill audits, run scripts/audit-skills.js before changing the target. Prioritize P0/P1 before P2, run confirmed-safe verification, then re-audit.",
    "externalSkillPolicy": "Generated team skills may declare external skills, but installation requires explicit user authorization."
  },
  "privacy": {
    "portable": true,
    "omitLocalSkillNames": true,
    "policy": "Do not store environment-specific, locally downloaded, private, or company-internal skill names in generated runtime files."
  }
}
